{
  "agent": "qa-acceptance",
  "status": "success",
  "summary": "All 11 acceptance criteria pass. Quick Play card is discoverable on HomeScreen between Daily Climb and Challenge cards. Full user flows validated: join -> search (overlay with spinner + cancel) -> match (navigate to /duel/:id) OR timeout (retry + back) OR error (retry + back). Haptics fire at correct points. Accessibility meets requirements (role=dialog, aria-modal, assertive live region, 48px targets). Cleanup properly handles unmount. Recovery from all terminal states works via retry and back buttons. 26 tests cover all state transitions including boundary cases.",
  "timestamp": "2026-09-19T19:05:00Z",
  "goal": "Validate 1v1 Quick Play against acceptance criteria",
  "artifacts": [],
  "exitCriteria": {
    "AC-1_card_visible": true,
    "AC-2_join_overlay": true,
    "AC-3_polling_match": true,
    "AC-4_cancel": true,
    "AC-5_timeout": true,
    "AC-6_errors": true,
    "AC-7_haptics": true,
    "AC-8_accessibility": true,
    "AC-9_cleanup": true,
    "AC-10_instant_match": true,
    "AC-11_409_resume": true,
    "discovery": true,
    "failure_recovery": true,
    "success_next_step": true
  },
  "feedback": [],
  "learnings": [],
  "nextStage": "integrator"
}
