{
  "agent": "verifier",
  "status": "success",
  "summary": "All quality gates pass. Lint clean (0 warnings), typecheck clean (0 new errors; pre-existing TS errors in GuestShell, ClimbScreen, ProfileScreen unchanged), 707 tests pass across 78 files. The new useMatchmakingQueue hook and HomeScreen Quick Play additions introduce no regressions. The hook is well-structured with proper cleanup, mount tracking, and error handling.",
  "timestamp": "2026-09-19T18:18:00Z",
  "goal": "Verify 1v1 Quick Play implementation on mobile",
  "artifacts": [],
  "exitCriteria": {
    "lint_passes": true,
    "typecheck_passes": true,
    "tests_pass": true,
    "no_regressions": true
  },
  "feedback": [],
  "learnings": [
    {
      "topic": "mobile-testing",
      "forAgents": ["software-engineer"],
      "kind": "lesson",
      "insight": "The useMatchmakingQueue hook would benefit from unit tests covering the state machine transitions, but the existing test infrastructure doesn't have a pattern for testing mobile hooks in isolation. The hook depends on apiFetch (CapacitorHttp wrapper) and haptics which need mocking.",
      "action": "Consider adding a vitest setup for mobile hooks with proper mocks for apiFetch and haptics modules.",
      "confidence": "medium"
    }
  ],
  "nextStage": "reviewer"
}
